,검색 키워드,검색 범위,글제목,등록일(제안),분야,처리기관(제안),현황및문제점(제안),개선방안(제안),기대효과(제안),첨부파일여부(제안),검토내용(결과),실시결과(결과),첨부파일여부(결과),처리기관(결과),등록일(결과)
13,원자력,내용,외자항목 국산화를 위한 정부지원 방안(행안부-매경) 지식경제부,2009-03-26,산업/방송/통신/과학,산업통상자원부,"이 제안은 행정안전부와 매일경제가 공동으로 추진하고 있는「경제활력 찾기 국민제안 운동」(www.reco.or.kr)을 통하여 네티즌의 활발한 토론과 평가과정을 거쳐 제안으로 발굴된 것입니다. 특히, 경제살리기 위해 내수활성화 아이디어를 집중 발굴하여 도입이 가능하다고 판단되는 우수한 아이디어를 보내오니 적극적으로 검토하여 주시기 바랍니다. 일부실시, 부분실시, 수정실시도 가능하오니 적극적인 검토 당부드립니다. 참고로, 각급 행정기관에서는 제안자뿐만 아니라 채택 실시 공무원에 대해서도 공동포상을 실시하고 있음을 알려드립니다.  1. 현황 및 문제점 - 기업체(공공기관 포함)가 구매(사용) 하는 각종 자재가 통상 외국 자재인 경우가 많음 - 이는 무역수지 적자 증가 및 외환보유고 감소에 일조  2. 개선방안 - 자재에 대한 국산화 유도와 국산화 기업에 대한 각종 세수지원방안 마련 - 국산화시 투입되는 초기투자비를 정부에서 적극 지원하여 기업 참여 유도 - 공개입찰 시 국산품에 가점을 적용하여 가격경쟁력에서 불리한 부분을 보완  3. 기대효과 - 수입 감소로 무역수지 개선, 국내기업 물량 증가로 기업 경기 활성화, 수급 및 사후관리(A/S) 용이  4. 상세 제안내용 1) 정부지원을 통해서 국내 산업을 육성하는 방안은 적극 추진 필요 국산화 유도를 위해서는 R&D 세제지원을 통한 투자 활성화가 가장 현실적인 방안이라 판단됨. 우선 매년 연장되는 임시 투자세액공제를 가능하면 영구화하여 기업들의 투자확대를 유도해야 함 또 R&D 비용에 대한 세액공제 확대도 고려해 볼만함. 현재 대기업의 연구개발비가 우리나라 총 R&D에서 차지하는 비중이 70%이상으로 높은 상태인데, 국산화를 유도하기 위해서는 이러한 투자・생산능력이 있는 대기업에 대한 지원을 확대하는 것이 효과적 그러나, 총액기준 R&D비용 세액공제율을 보았을 때 우리나라 대기업은 3~6%로 중소기업 25%에 비해서도 적고, 국제적으로도 공제율이 높지 않은 실정임. 대기업이 보다 R&D 투자를 늘릴 수 있도록 대기업의 연구 및 인력개발비 등 R&D 비용에 대한 세액공제 확대를 고려해 볼 필요가 있음 * 2009년부터 중소기업 R&D비용 세액감면을 15%에서 25%로 확대적용(조세특례제한법 제10조) * 주요국 R&D세액공제율(%, 대기업/중소기업): 한국(3˜6/25), 일본(8˜10/12), 캐나다(20/35), 포르투갈(20/20), 스페인(30/30) 등 중소 제조업체에 대해서는 네트워크론 확대 등을 통한 자금 지원책을 강구할 수 있음. 네트워크론은 담보능력이 없어 자금확보에 어려움을 겪고 있는 중소기업의 자금난을 해소하기 위해 ‘06. 7월 도입한 제도로서, 조달청과 계약한 업체가 별도의 담보 없이 조달청 계약서만으로 계약금약의 80%까지 생산소요자금을 쉽게 대출받을 수 있는 제도임 * 네트워크론 적용 시중은행은 06년 3개였으나, 최근(‘09.3월) 조달청・금융결제원・13개 시중은행 간 네 트워크론 MOU 체결로 적용은행이 13개로 확대되었음. 또한 이번 MOU 체결로 기업 적용대상도 총액계약(42%)에서 단가계약(58%)까지 확대 * 총액 및 단가계약 (총액계약) 계약목적물 전체에 대하여 단가가 아닌 총액으로 계약체결하는 것으로 통상적인 계약방법 (단가계약) 여러 기관에서 공통으로 사용하고 수요빈도가 높은 품목에 대하여 단가에 의하여 계약을 체결하는 방식 * 네트워크론 참여은행 확대 (현행) 기업은행, 우리은행, 하나은행(3개 은행) (확대) 기업은행, 우리은행, 하나은행은 재협약 경남은행, 국민은행, 광주은행, 농협중앙회, 대구은행, 부산은행, 신한은행, 제주은행, 전북은행, 제일은행 추가협약 (13개 시중은행 - 금융결제원이 정보중계)  <참고> 최근 국산화 성공사례 한국수력원자력은 한국씰마스타(주)와 함께 원전의 냉각 계통에 사용되는 핵심부품을 자체 개발하는 데 성공(‘09. 3월) 두 회사는 2004년부터 전량 수입에 의존해오던 고가의 정밀 핵심부품인 `원자로냉각재 펌프 밀봉장치의 국산화에 착수, 10억여원의 개발비를 공동투입해 5년간 자체개발 연구를 진행해왔음 금번 부품개발 성공은 원전 4호기에 들어가는 부품 구매비용의 대폭 절감 및 원전의 기술자립에 크게 기여할 전망이며, 향후 연간 120억~150억원 규모의 수입대체 효과가 예상됨 이는 대중소 상생협력에 의한 결과라는 점에서 더욱 의미있는 사례",,,,"안녕하십니까? 지식경제부 산업경제정책과 김상효입니다  먼저 귀하의 제안에 대해 깊은 감사의 말씀을 드리며 검토의견을 회신하오니 참고하시기 바랍니다.  임시투자세액공제제도는 기업들의 투자에 대해 세액공제를 부여함으로써 경기 활성화를 유도하기 위해 임시적으로 도입된 제도이나 최근들어 매년 일몰이 연장되어 동 제도를 항구화하자는 의견이 많은 것이 사실입니다. 물론 최근의 경기상황을 고려할 때 항구화하는 방법도 검토할 필요가 있겠지만, 동 제도가 항구화된다면 조세를 통한 경기조절능력이 많이 약화되는 부작용이 우려됩니다. 따라서 동 제도는 매년 그 필요성 여부를 깊이있게 검토하여 일몰여부를 결정하고 있으며 금년에는 특히 경기침체를 고려하여 기본 10%공제와 함께 투자증가분에 대해 추가적으로 10% 공제를 하여 공제폭을 대폭 늘려 운영하고 있습니다.  둘째, 네트워크론은 자금조달에 애로를 겪고 있는 중소기업을 지원하기 위해 도입된 제도로서 최근 상생협력의 확산에 따라 대기업과 관계 협력업체를 중심으로 더욱 활성화되고 있습니다. 정부도 이를 더욱 촉진하기 위해 작년 조세관련 법률을 개정하여 네트워크론을 실시하는 대기업에 대한 조세 지원을 확대하여 동 제도가 중소기업을 지원하는 주요한 방식으로 자리매김할 수 있도록 제도상의 인센티브를 부여하고 있습니다.  끝으로R&D 세액공제는 R&D 비용으로 적용받는 범위가 각 국가마다 달라 오로지 공제율만을 가지고 비교하기는 힘든 측면이 있습니다만 작년 중소기업의 공제율을 상향 조정한 것은 대기업에 비해 R&D 역량이 취약한 중소기업에게 보다 많은 유인을 제공하기 위한 것이었고 대기업에 있어서도 제도의 실효성 확보를 위해 R&D 적용방식을 대폭 완화하였습니다. 다만 지적하신바와 같이 우리나라 R&D를 선도하고 있는 대기업의 R&D확대를 위한 세액공제율 확대는 관계부처와 그 필요성 및 확대폭에 대해 심도 있는 논의를 필요한 사항이라 생각합니다. 대기업의 선도적 R&D 확대를 통한 경기부양 및 위기 후 다가올 미래를 보다 선제적으로 대응하기 위한 다각적인 방안에 대해 금년도 조세관련 법률 개정시 지적하신 내용을 조세 당국과 깊이있게 협의하도록 하겠습니다.  다시 한 번 귀하의 고견에 깊이 감사드립니다.",임시투자세액 공제 일몰연장 등을 기획재정부에 건의,,산업통상자원부,2009-03-31
16,원전,내용,통화연결음의 선한 영향력,2021-07-20,교육/문화/체육/관광,울산광역시교육청,"○ 코로나19로 인해 일선 학교, 교육청에 비대면 민원상담 전화 지속적 증가 ○ 민원 상대 교원, 직원들의 애환이 속출하며 이들에 대한 보호는 미비한 현황 ○ 민원상담 업무의 효율적 처리와 악성 민원전화(장난, 음해, 협박, 욕설 등)로 인한 언어폭력을 예방하기 위한 조치 필요",○ 상호 존중 음성 안내 컬러링 도입 - 민원 상대 직원 보호와 효과적인 상담 진행을 위해 행정 전화에 음성 안내 컬러링(통화연결음)을 도입 - 통화 전 사전 고지를 통해 상호 존중하는 상담문화에 대한 인식을 일깨울 수 있는 계기 마련 ○ 컬러링 안내 문구(예시) - 민원 청취 의지를 부드럽게 전달하며 직원 보호 조치를 강조하는 데 초점 - “여러분의 목소리를 정성껏 경청하겠습니다. 존중의 언어로 마음을 전달해주세요.” - 위와 같은 감성 멘트로 소통을 시작하여 민원인의 심리적 경계를 자극하는 울림 전달,○ 새로운 통화연결음 제작을 통해 서로를 배려하고 존중하는 문화 조성 ○ 민원응대 직원을 보호함과 동시에 업무 능률 향상을 기대 ○ 상호 존중으로 더욱 진정성 있는 민원서비스를 제공,,이 제안은 2021년 공무원 My Job Idea 제안 공모전에 접수된 제안으로 제안심사위원회에서 채택하여 각 학교에 제안의 아이디어 사례를 학교에 안내하고자 함.,"1. 관련: 정책관-7353(2021. 8. 23.) 「2021년 제안 아이디어 사례 안내」  2. 제안의 실시 범위, 수혜 대상 등을 고려하여 현장 사례 안내에 적합한 제안을 선정하여 부분 채택하였음  3. 교내 의견 수렴 및 다양한 수요를 반영하여 학교별 실정에 맞게 제안사항을 적용하고 제안의 점진적 확대 및 실시 유도",,울산광역시교육청,2021-07-20
17,원전,내용,용인시 홈페이지에서 부서 및 담당자 업무공개시 부서위치 추가 제안,2020-01-09,행정/자치/안전,경기도 용인시,1.현재는 용인시 홈페이지에서 담당자를 찾을때 무슨 과! 담당 누구! 연락처! 업무로만 되어 있습니다  2.원하는 부서를 찾아 가기 위해서는 해당 과에 전화를 해서 위치를 물어 보아야 하는 번거로움이 있습니다  3.용인시를 처음 방문하시거나 어쩌다 방문하시는 분들은 본인이 원하는 해당과 위치를 찾기가 어렵습니다  4.전체 사다리 조직도에서는 층수가 나와 있지만 민원인이 해당과를 검색하고 들어가면 해당과 위치를 알수 없습니다,"1.현재 홈페이지에 해당과, 담당자, 연락처로만 되어 있는 곳에 해당과에( 장소 ) 위치를 추가로 넣어 공지를 합니다 ** 예를 들어** **총무과 """"""(본청 2층)"""""" 위치추가함 이철주과장 560-4021 ○ 총무과 업무 총괄  첨부파일을 참고해 주세요",1.홈페이지 검색만으로 민원인이 원하는 해당과를 편리하게 찾을수 있습니다  2.민원인이 해당과 위치를 물어보는 민원전화를 줄일수 있습니다  3.적극적인 행정으로 민원인의 불편을 줄여줍니다  4.국민들 입장에선 매우 고맙고 친절한 변화가 될것입니다,"
위치안내.jpg
위치안내2.jpg","○ 용인시 홈페이지에 대한 관심과 의견에 감사드립니다. ○ 현재 용인시 홈페이지는 조직도에서 부서명옆에 부서위치를 확인할 수 있으나, 민원인의 편의성 증진을 위하여 귀하께서 제안 하신 각 부서별 직원안내 페이지내에 해당 부서 위치(예: 본청 6층) 표시를 2월내에 조치하도록 하겠습니다. ○ 귀하께서 요청하신 사항과 같이 항상 시민의 편의성을 위하여 더나은 서비스가 이루어 질 수 있도록 꾸준히 노력하겠습니다. ○ 더 궁금하신 사항은 용인시 정보통신과(☎ 031-324-2084)로 연락주시면 자세하게 안내하여 드리겠습니다. 감사합니다.",용인시 홈페이지에 대한 관심과 의견에 감사드립니다. 귀하께서 제안하신 조직도 부서위치 표시를 홈페이지내에 2020년 2월 말에 반영 완료 하였습니다.,,경기도 용인시,2020-01-28
18,원전,내용,각 기관별 홈페이지에서 부서 및 담당자 업무공개시 부서위치 추가 제안,2020-01-08,행정/자치/안전,소방청,1.현재는 각 기관별 홈페이지에서 담당자를 찾을때 무슨 과! 담당 누구! 연락처! 업무로만 되어 있습니다  2.원하는 부서를 찾아 가기 위해서는 해당 과에 전화를 해서 위치를 물어 보아야 하는 번거로움이 있습니다  3.각 기관을 처음 방문하시거나 어쩌다 방문하시는 분들은 본인이 원하는 해당과 위치를 찾기가 어렵습니다,"1.현재 홈페이지에 해당과, 담당자, 연락처로만 되어 있는 곳에 해당과에( 장소 ) 위치를 추가로 넣어 공지를 합니다 ** 예를 들어** **총무과 """"""(본관 2층)"""""" 위치추가함 이철주과장 560-4021 ○ 총무과 업무 총괄  첨부파일을 참고해 주세요",1.홈페이지 검색만으로 민원인이 원하는 해당과를 편리하게 찾을수 있습니다  2.민원인이 해당과 위치를 물어보는 민원전화를 줄일수 있습니다  3.적극적인 행정으로 민원인의 불편을 줄여줍니다  4.국민들 입장에선 매우 고맙고 친절한 변화가 될것입니다,"
위치안내.jpg
위치안내2.jpg","1. 국민신문고 제안신청(신청번호 1AB-2001-001401) 내역의 검토결과에 따라 아래와 같이 조치하고자 합니다.  2. 제안자 및 제안내용 가. 제안자 : 김인환(인천시 서구 완정로 65, 109-1501)  나. 제안내용 : 소방청 홈페이지의 기관 및 부서소개란에 각 부서의 청사내 위치를 안내하여 민원인의 불편을 해소하여 주시기 바람  3. 조치계획 : 소방청 홈페이지 기관소개 메뉴의 부서명란에 각 부서의 청사내 위치(예시 : 정부세종2청사 17동 3층)를 명시하여 안내. 끝.","1. 국민신문고 제안신청(신청번호 1AB-2001-001401) 사항을 아래와 같이 조치하였기에 실시결과를 통지드립니다.  2. 제안자 및 제안내용 가. 제안자 : 김인환(인천시 서구 완정로 65, 109-1501)  나. 제안내용 : 소방청 홈페이지의 기관 및 부서소개란에 각 부서의 청사내 위치를 안내하여 민원인의 불편을 해소하여 주시기 바람  3. 조치결과 : 소방청 홈페이지 기관소개 메뉴의 부서명란에 각 부서의 청사내 위치(예시 : 17-3동 3층)를 명시하여 안내. 끝.",,소방청,2020-01-09
23,원전,내용,교육청 홈페이지에서 부서 및 담당자 업무공개시 부서위치 추가 제안,2020-01-07,교육/문화/체육/관광,충청북도교육청,1.현재는 교육청 홈페이지에서 담당자를 찾을때 무슨 과! 담당 누구! 연락처! 업무로만 되어 있습니다  2.원하는 부서를 찾아 가기 위해서는 해당 과에 전화를 해서 위치를 물어 보아야 하는 번거로움이 있습니다  3.교육청을 처음 방문하시거나 어쩌다 방문하시는 분들은 본인이 원하는 해당과 위치를 찾기가 어렵습니다,"1.현재 홈페이지에 해당과, 담당자, 연락처로만 되어 있는 곳에 해당과에( 장소 ) 위치를 추가로 넣어 공지를 합니다 ** 예를 들어** **총무과 """"""(본청 2층)"""""" 위치추가함 이철주과장 560-4021 ○ 총무과 업무 총괄  첨부파일을 참고해 주세요",1.홈페이지 검색만으로 민원인이 원하는 해당과를 편리하게 찾을수 있습니다  2.민원인이 해당과 위치를 물어보는 민원전화를 줄일수 있습니다  3.적극적인 행정으로 민원인의 불편을 줄여줍니다,"
위치안내1.jpg
위치안내2.jpg","1. 종합 검토의견  안녕하십니까? 제안 참여에 감사드리며 귀하께서 제기하신 제안에 대해 다음과 같이 회신하여 드립니다. 김인환님께서는 ‘교육청 홈페이지에서 부서 및 담당자 업무공개 시 부서위치를 추가’하는 것에 대하여 제안해주셨습니다.  귀하께서 제안하신 사항을 검토한 결과는 다음과 같습니다. 1. 제안해주신 내용과 같이 우리교육청 홈페이지 교육청소개〉기구표〉전화번호 안내〉 담당자와 연락처로 구성된 메뉴에 해당과에 대한 장소(위치)를 추가 안내하여 사용자의 편의성을 제공하도록 하겠습니다. 2. 다만, 홈페이지 수정을 위해서는 다소 시간이 필요할 것으로 예상되어 메뉴가 수정되기 전까지는 각 부서의 위치를 그림을 통해 안내하고 있는 도교육청 홈페이지 청사안내도 메뉴를 활용하시거나, 3. 홈페이지를 참고하지 못하고 직접 방문하시는 분들을 위하여 교육청 각 건물에 안내판과 청사배치도를, 본관 1층에는 안내데스크를 운영하고 있으니 참고하여 주시기 바랍니다.  귀하의 제안에 만족스러운 답변이 되었기를 바라며, 답변 내용에 대한 추가 설명이 필요한 경우 미래인재과 이혜영(043-290-2725)에게 연락주시면 성심성의껏 답변해 드리겠습니다. 앞으로도 충청북도교육청에 많은 관심을 갖고 소중한 의견을 주시기 바랍니다. 감사합니다.","안녕하십니까? 제안 참여에 감사드리며 귀하께서 제기하신 제안에 대해 다음과 같이 회신하여 드립니다. 귀하께서는 ‘교육청 홈페이지에서 부서 및 담당자 업무공개 시 부서 위치를 추가’하는 것에 대하여 제안해주셨습니다.  1. 제안해주신 내용과 같이 우리 교육청 홈페이지 교육청 소개 〉기구표 〉전화번호안내 메뉴에 담당자와 연락처로 구성된 해당 과에 대한 장소(위치)를 추가 안내하여 사용자의 편의성을 제공하도록 개선하였습니다. 2. 또한 도교육청 홈페이지 청사안내도 메뉴를 통해 그림으로도 볼 수 있으며, 3. 직접 방문하시는 분들을 위하여 교육청 각 건물에 안내판과 청사 배치도를, 본관 1층에는 안내데스크를 운영하고 있으니 참고하여 주시기 바랍니다.  귀하의 제안에 만족스러운 답변이 되었기를 바라며, 답변 내용에 대한 추가 설명이 필요한 경우 미래인재과 박준엽주무관(043-290-2877)에게 연락주시면 성심성의껏 답변해 드리겠습니다. 앞으로도 충청북도교육청에 많은 관심을 갖고 소중한 의견을 주시기 바랍니다. 감사합니다.",,충청북도교육청,2020-01-23
32,원전,내용,각 시.구청 홈페이지에서 부서 및 담당자 업무공개시 부서위치 추가 제안,2020-01-07,행정/자치/안전,인천광역시,1.현재는 각 시.구청 홈페이지에서 담당자를 찾을때 무슨 과! 담당 누구! 연락처! 업무로만 되어 있습니다  2.원하는 부서를 찾아 가기 위해서는 해당 과에 전화를 해서 위치를 물어 보아야 하는 번거로움이 있습니다  3.각 시.구청을 처음 방문하시거나 어쩌다 방문하시는 분들은 본인이 원하는 해당과 위치를 찾기가 어렵습니다,"1.현재 홈페이지에 해당과, 담당자, 연락처로만 되어 있는 곳에 해당과에( 장소 ) 위치를 추가로 넣어 공지를 합니다 ** 예를 들어** **총무과 """"""(본청 2층)"""""" 위치추가함 이철주과장 560-4021 ○ 총무과 업무 총괄  첨부파일을 참고해 주세요",1.홈페이지 검색만으로 민원인이 원하는 해당과를 편리하게 찾을수 있습니다  2.민원인이 해당과 위치를 물어보는 민원전화를 줄일수 있습니다  3.적극적인 행정으로 민원인의 불편을 줄여줍니다,"
위치안내1.jpg
위치안내2.jpg","1. 안녕하십니까? 먼저 시정에 관심을 가져주시고 좋은 제안을 해주신 귀하께 감사드립니다. 2. 귀하께서 제안해주신 내용은 “인천시청 홈페이지 내 부서정보에 위치정보 추가”로 이해됩니다. 3. 현재 우리시 웹사이트는 “부서정보(부서명, FAX번호), 직원정보(직위, 담당자, 전화번호, 담당업무)”를 서비스하고 있습니다. 4. 인천광역시 웹사이트를 이용하는 시민의 편의성 증진을 위해 귀하께서 제시해주신 제안을 적극 검토하여 부서정보에 “위치정보”를 추가하여 반영하도록 하겠습니다. 5. 다만, 현재 서비스 중인 부서 정보는 내부행정시스템과 연계되는 자료로써 프로그램 개발을 하여 서비스하기까지 다소 시일이 걸릴 수 있음을 양해 부탁드립니다. 6. 다시 한번 귀하의 고견에 감사드리며, 답변 내용에 대한 추가 설명이 필요한 경우 정보화담당관실 양승민 주무관 (☏032-440-2323) 에게 연락주시면 친절히 안내해 드리도록 하겠습니다. 감사합니다. 끝.","1. 안녕하십니까? 먼저 시정에 관심을 가져주시고 좋은 제안을 해주신 귀하께 감사드립니다. 2. 귀하께서 제안해주신 내용인 “인천시청 홈페이지 내 부서정보에 위치정보 추가” 사안이 2020. 2. 14일자로 홈페이지>조직도에 반영되었습니다. 3. 이해를 돕기 위해 조직도 캡쳐화면을 첨부하오니 참고하여 주시기 바랍니다. 4. 다시 한번 귀하의 고견에 감사드리며, 답변 내용에 대한 추가 설명이 필요한 경우 정보화담당관실 양승민 주무관 (☏032-440-2323)에게 연락주시면 친절히 안내해 드리도록 하겠습니다. 감사합니다. 끝.",,인천광역시,2020-01-08
