,검색 키워드,검색 범위,글제목,등록일(제안),분야,처리기관(제안),현황및문제점(제안),개선방안(제안),기대효과(제안),첨부파일여부(제안),검토내용(결과),실시결과(결과),첨부파일여부(결과),처리기관(결과),등록일(결과)
10,기후변화,내용,"동, 서, 남해의 천혜의 자연 보고를 관광상품으로 개발하는 방안",2008-05-13,교육/문화/체육/관광,문화체육관광부,"동해, 남해, 서해로 둘러싸여 삼면이 바다인 대한민국의 영해는 분명 세계의 선진해양 국가들보다 조금도 손색이 없을 것이나 우리의 현실은 저들국가 보다 관광자원으로서의 그 활용도 및 인프라 시설에 있어서는 아마도 상당히 뒤떨어져 있을것입니다.  그것은 아직 우리가 바다를 이용하는 기술이나 축적된 노하우가 없어서 있을 수도 있지만 바다를 적극적으로 활용하기위한 관심과 관광상품화 하기위한 전략적 개발의지가 부족한것은 물론이요 가장 기초적인 부분에서의 관광, 레저 이용수준이 아마도 아마추어 수준이하 일 것이라 판단됩니다.  정부에서는 그 환경적 자연의 寶庫 인 한려해상 국립공원과 다도해 해상국립공원이란 명칭으로 지정하고 보호하고 있습니다만, 이런 천혜의 자연보고를 관광하기 위한 방법으로 유람선을 이용하여 다도해 해상의 섬 주위를 돌거나 겨우 섬에 상륙하여 돌아보는 것이 고작입니다. (금년 상반기부터 부산을 기점으로 크루즈 관광선 운행시작)  한때 울릉도 관광을 위하여 헬리콥터를 이용하여 섬 주변 상공을 선회하여 해양항공 관광을 시도해보았으나 불의의 항공사고로 인하여 중도 포기할 수밖에 없었습니다. , 근래에 들어 바다의 중요성과 독도에 대하여 많은 국민들이 공감하고 있습니다. 왜냐면 그것은 우리의 영해, 국토이기 때문이기도 하지만 앞으로 무한대의 자원과 재원을 바다로부터 얻을 수 있을 뿐 만 아니라 정치, 경제적, 군사적, 관광적인 특수성이 있기 때문입니다.  정치적으론 일본과 영토분쟁과 동해의 표기를 놓고 일본은 끊임없이 억지를 부리고 있을 뿐만 아니라 독도의 영토마저 끈질기게 자기의 영토라 부르고 표기하고 세계에 오히려 떠벌리고 있는 실정입니다.  경제적으로는 지금 당장 심해 해저에 있을지도 모를 원유는 물론이요, 천연적 자연 무공해 생수인 심층수는 현재 상품화 되어 음료수로서 마실 수 있을 것이며, 청정연료와 엄청난 량의 니켈이나 망간 같은 자원이 엄청나게 묻혀있기에 경제적인 가치는 금액으로 환산하기 어려운 寶庫라 할 수 있습니다.  남해의 끝자락 전설의 섬으로 알려진 이어도는 현재 해상플랜트 구조물이 설치되어 군사적 임무와 기상환경, 해상 로 안전등의 임무를 무인으로 가동되고 있어 보이지 않는 해상 전진기지로서의 역할을 충실히 그리고 100% 효과를 보고 있습니다.  동해, 남해, 서해의 관광적인 가치는 엄청난 보고라 할 수 있습니다. 동해의 오염되지 않은 해저의 수중식물과 물고기들은 자연의 그대로임을 보여주고 있으며 남해의 섬들은 천혜의 절경들로 이루어져 있으며 육지의 기암괴석과 천연기념물의 철새들의 군무는 그야말로 장관을 이루고 있습니다.  거제도 및 여수만 주변의 한려 해상 국립공원과 고흥반도 해상국립공원, 완도해역, 추자도, 거차 군도, 도초 비금 해역, 대흑산도 홍도해역 해상국립공원으로 이어지는 서, 남해의 천혜자연과 자원은 세계 어느 곳보다도 뒤떨어지지 않는 자연의 보고인 것입니다.  서남해의 끝자락 가거도는 인구 700여명의 면적 918ha 의 작은 섬 이지만 우뚝 솟아있는 독실산 (해발 639 M)과 기암괴석의 절경과 희귀약초와 풍부한 해산물과 한때 중국과의 중간 기착지로서의 역사를 갖고 있습니다.  그러니까 동해에는 독도란 특성상품이, 남해에는 전설의 섬으로만 여겨졌던 꿈의 섬이 현실로 나타나 지금은 작은 암초의 해상 플랜트의 인공 섬으로서, 서해의 끝자락엔 가거도(소흑산도)란 옛날 중국과의 무역의 중간기착지로서 기막힌 동, 서, 남해의 끝 섬이 자리하고 있는 사실에 인도네시아의 발리보다 못할 것이 무엇이며 하와이의 와이키키 해변보다 뒤떨어질 것이 있을까요? 이처럼 자연적인 천혜의 조건인 상품을 특성화하여 특화 시설 화 하여 관광 상품으로 개발하지 않는다면 무엇을 개발상품화 하겠습니까?  지금 일본은 러시아, 중국, 대만, 대한민국의 영토에 대하여 억지 주장으로 분쟁을 일으키고 있습니다. 여기에 자연스럽게 대응 할 수 있는 방안으로 울릉도, 독도, 이어도, 가거도 주변 해역에 초대형 해상 관광플랜트 구조물을 설치하자는 제안입니다.  천혜의 자원보고인 위의섬들을 더 이상 훼손하지 않을뿐더러 관광객을 유치하기에는 지리적조건 및 관광 부지를 제공할 수 없는 제한적 공간의 부족함이 뒤따르고 있습니다. 따라서 이를 해결하기 위한 방법으로는 부두에 대형바지선이나 대형선박을 이용한 방법이 있을 수 있으나 이 또한 적절치 못합니다. 왜냐면 대형선박을 접안하기 위해서는 부두의 확장공사를 해야 하나 공간이 부족하기 때문에 적합하지 못하며, 기후변화에 따른 대형 태풍이나 기상악화로 인하여 대형바지선을 부두에 정박하기가 어려운 실정이라 생각됩니다.  국내, 외적인 관광명소가 되기 위해서는 많은 다수의 내, 외국인 관광객들의 숙박, 식사제공 및 관람, 휴식 공간을 마련 제공하여 유치하여야만 하나 이런 공간을 제공할 수가 없기 때문입니다. 국제적인 관광의 명소를 상품화하여 만들기 위해서는 여러 가지 환경과 조건이 갖추어져야 합니다.  이를 충족시켜 주기 위해서는 직접 섬에 구조물 설치 공사를 하지 않아도 가능한 방법을 취해야 할 것입니다. 울릉도와 독도의 부두와 가까운 거리에 철골과 콘크리트 구조물을 혼합한 초대형 해상플랜트 구조물을 설치하는 것입니다.  앞으로 2010년이면 수중에서 5~10 M 떠다니는 위그선이 개발되어 상용화 한다는 발표가 있었습니다. 독도의 해상 부두 앞에 우리의 기술과 기술력으로 상품화된 수상 비행기와 해상 플랜트 구조물을 들어선다면 이 얼마나 벅차고 감동적이지 않을까요?  대략 규모면에서 본다면 적어도 5,000 톤급의 유람선을 접안할 수 있는 접안시설과 수상비행기를 계류 할 수 있으며, 관광객을 수용할 수 있는 객실의 수는 적어도 100여개 이상 갖출 수 있도록 하며, 대형 헬리콥터 착륙장은 물론이고 자체적인 발전시설과 정화시설은 물론 인공 해수욕장, 일광욕장, 사우나 시설을 갖추고 다양한 요리 코스를 제공 한다면 엄청난 관광과 관람 효과를 거둘 수 있을 것입니다.  숙박시설은 굳이 밀폐 하지 않고 유리 창문을 통하여 주, 야간으로 바다와 섬주변의 해역을 24시간 감상 할 수가 있는 것입니다. 한편으로는 대형선박을 접안하여,이용하기에 안전하게 여객을 수송할 수가 있으며 또한 비상시 헬기를 이용하여 섬의 주변 해역 상공을 관광 상품화 하여 특화적인 관광의 묘미를 느끼게 하는 것이지요.  생각만하여도 얼마나 기대되는지 모릅니다. 관광객을 대형헬기를 이용하여 수송과 안전, 그리고 비상시를 대비하고 우리의 자체 기술력으로 개발한 수상 위를 떠다니는 위그선으로 관광객을 울릉도, 독도, 이어도, 가거도를 비롯한 우리의 영해이며 천혜의 절경 인 해상국립공원을 관람 한다면 세계의 유명 관광지가 부럽겠습니까?  자연을 훼손하지 않으므로 서 자연환경 민원을 유발하지 않고 자연을 그대로 살리고 울릉도, 독도, 이어도, 가거도를 관광 상품 개발 화하기 위해서는 섬 안에서 구조물을 설치한다거나 공사를 하기에는 지리적 환경적 도저히 역부족일 것입니다.  그러나 해상 플랜트 구조물은 육지에서 만들어 이동하기 때문에 설치라든가 구조물의 공사를 하기에는 전혀 제약을 받지 않을뿐더러 우리의 기술력으로 해상 구조물이나, 해양 석유시추선을 설계하고 자체적으로 제작 할 수 있는 기술을 보유하고 수출을 하고 있으며, 이미 남해의 이어도 섬에 해상플랜트 구조물을 무인으로 운행하고 있는 경험이 있기에 전혀 어려움이 없는 것입니다.  또한 해체라든가 이동을 하기에는 전혀 제약이나 무리가 따르지 않으며 제작하기 위한 공사의 기한도 대폭 줄여 설계가 마무리 되면 곧바로 공사에 착수 하여 불과 2~3년 안에 설치가 가능 할 것이며, 세계는 지금 시간과의 싸움과도 같은 급격히 변화 하고 있기에 하루속히 이와 같은 특화 관광 상품을 개발해야 할 것이라 생각 합니다.  가거도의 특산품은 물론이요 풍부한 해산물과 기암절벽과 풍경은 우리가 지금껏 외면하고 몰랐으며 관광 상품으로 개발하지 못한 것에 기인하지 절대로 우리의 관광 상품이 없기 때문은 아닐 것입니다.전설의 섬 이어도는 얼마나 흥미진진하고 감동적인 섬이 아닌가요? 꼭 발리 섬이나 사이판이나 괌이나 ,와이키키의 해변이 아니면 우리국민들은 우리의 관광 상품을 외면하겠습니까?  인천항을 출발하여 덕적도를 지나 격렬 비열도 를 지나고 달려서 흑산도를 돌아 홍도 회를 맛보며 홍도 대 풍란이요 석곡이요 진귀한 식물과 천연기념물 후박나무요 동백꽃의 전설을 듣고 관광하고 만재도, 상태, 중태, 하태도 넘어 서, 남해의 끝자락 가거도 를 관광하고 섬주위의 칼바위 기암절벽을 감상하고 독실산 정상에 올라 주변 경치 풍경과 저녘 노을 의 황금 빛 바다의 석양은 황홀 하지 않을까요?  전설의 섬 이어도에 도착하면 한 많은 전설의 세계로 한번 빠져 봄은 소설속의 주인공으로 감탄하고, 마라도와 제주의 아름다운 광경은 말로 표현이 어려울 것이며 한려 해상 국립공원을 굽이굽이 돌아 한산대첩의 한산도와 명량 해전, 당포해전 의 충무공의 충정어린 숨결을 느낀다면 무엇과 비교 할 수가 있겠습니까?  거제의 초대형 조선소를 뒤로 현해탄을 지나 동해의 푸르고 푸른 물결, 수십 수백 마리의 참 돌고래 떼의 자연 수중 쇼를 관람 한다면 탄성이 저절로 터져 나오겠지요!  울릉도 오징어 고기잡이배의 수많은 전등불은 온통 동해의 바다를 불 밝힐 듯이 등불의 군무를 이루고, 오염되지 않은 밤하늘의 별들은 반짝반짝 영롱한 빛이 수를 놓을 것이며, 이른 새벽하늘동쪽 끝자락에서는 여명의 밝은 빛 태양이 떠오르는 감동적인 역사의 하루를 시작하는 장관이 연출될 것입니다.  독도의 해상호텔에서 맛보는 해산물의 진미를 느끼고 독도의 황홀한 첫날밤은 가슴 설레 이며 가슴속 깊이 감동이 전해져 친구와 연인과 부모형제와 부딪히는 와인의 건배는 추억의 한 장에 남기어 영원히 기억될 것입니다.  태초의 신비를 간직하듯 아직 우리의 자연보고는 그대로인 채 그 대로 방치 되어, 진흙의 뻘 속에서 진주가 조개 속에서 나오기를 학수고대 하듯이 기다리고 있을지도 모릅니다.  금강산, 백두산 관광도 제주의 한라산과 설악산, 부산 해운대, 광안리 해수욕장도 빼어 놓을 수 없는 우리의 것이지만 우리의 자연조건을 이대로 놔둔다면 절대로 관광 대한민국의 미래는 희망적이지 않을지도 모릅니다.  지하철에서 버스로 버스에서 지하철로 연계하여 대중교통을 이용하듯이, 우리의 자연도 이처럼 자연스럽게 연계할 수 있는 대책 방안이 필요 합니다. 영동고속도로 끝 동해항에서 배편으로 울릉도, 독도로 이어지는 빤짝 유람이 아닌 영화의 한 장면처럼 사랑의 유람선 같은 크루즈 관광선 으로 하여금 관광의 폭을 이제는 넓히고 규모나 시설을 확충하고 첨단화 고급 화 한다면 분명 전략적인 관광상품으로서 성공할것이라 사료됩니다.  아직도 우리의 주위에서는 이런 개발 가능한 일들이 비일비재 할 것이지만 어느 것 하나 시작하지 않는다면 아무런 소용도 효과도 득도 이득도 없음은 물론이요, 세계의 관광선진 대국을 그냥 바라고만 있어야 하겠습니까. 외국관광상품으로 인한 무역적자가 갈수록 눈덩이처럼 커지고 있는데 반하여 우리의 대책은 아직 이렇다할 대책을 내놓지 못하고 있는 실정입니다. 이제 정부가 나서서 주도해 나간다면 어려운 국내경기를 부양하는데 일조 하는것은 물론이요 외화을 절약하는데 또한 일조하고 많은 인력을 고용함으로서 실업효과가지 거둘수 있는 방안이 된다면 일석 삼조의 효과를 거둘수 있을 것이라 생각합니다.  영세한 국내 관광을 한단계 도약시키는 계기가 될수 있기를 간절이 소망하며, 아울러 침체된 국내경기를 회복시키어 도서 지방은 물론 많은 국민들이 희망을 갖게 해주시기를 간절히 바라며 제안 하고자 하나이다. 부디 세밀히 연구 검토 하시기를 부탁드립니다.    2008년 5월 13일",,,,"ㅇ 안녕하십니까? 문화체육관광부 국민신문고에 좋은 의견 감사합니다.  ㅇ 지적하신 데로 해안권 관광개발의 중요성에 따라 문화체육관광부에서는『남해안 관광벨트 조성』(‘00년~’09년),『서해안권 관광개발』(‘08년~’17년), 『동해안권 관광개발』(‘09년~’18년) 및 가고싶은 섬 시범사업(‘07년~’09년)등 을 추진하고 있고 있습니다.  ㅇ 향후 위 사업 등의 추진을 통한 해안권 관광개발로 국내관광활성화 및 관광수지 적자를 해소할 수 있도록 노력하겠으며, 귀하께서 제안하신 기타 동,서, 남해의 관광상품개발 방안에 대해서는 관광정책 추진시 참고토록 하겠습니다.  감사합니다.","ㅇ현재 제안내용과 관련하여 기 추진중인 사업이 있으므로, 새로운 사업을 기획하여 채택하여 실시하는것이 아닌 기존 추진사업을 지속적으로 추진",,문화체육관광부,2008-05-27
12,원자력,제목,한국원자력의학원 설립과 관련한 연구원들의 제안,2007-01-22,산업/방송/통신/과학,과학기술정보통신부,"노무현 대통령님께 드립니다.  국정운영에 항상 바쁘신 줄 아오나 정부출연연구소 연구원으로서 소임을 다하기 위한 간청을 드리오니 관심과 선처를 바랍니다.  원자력의학원은 방사선의학 연구를 목적으로 과학기술부 산하 원자력연구소의 부설연구기관으로 설립되어 운영해 오던 중, 방사선관련 연구기능의 강화와 효율적 관리를 위한 국가적 필요성에 의하여 원자력연구소로부터 분리, 독립되어 ‘한국원자력의학원’(이하 의학원)이라는 특정연구기관으로 거듭나게 되었습니다. 이를 위하여 ‘방사선 및 방사선동위원소 진흥법’이 2006년 12월 26일 국회 본회의를 통과하여 개정 법율안이 공포되었고 지금은 그 설립을 위한 준비 작업이 진행되고 있습니다.  의학원은 현재 ‘방사선의학연구센터’ 와 ‘원자력병원’ 이라는 두개의 조직으로 구성되어 있습니다. ‘방사선의학연구센터’는 정부의 R&D 예산을 수탁하여 연구사업에 전념하는 연구원과 기능직 직원들로 구성되어 있으며 이들의 급여는 PBS 시스템과 연봉제를 따르고 있습니다. 이에 반하여 ‘원자력병원’은 환자진료라는 수익사업을 하고 있으며 이에 참여하는 의무직, 간호직 및 행정직 직원들의 급여체계는 PBS 시스템과 연봉제를 따르지 않고 있습니다. 이렇게 근본적으로 성격과 목적이 전혀 다름에도 불구하고 이 두 조직은 행정적, 회계적으로 통합되어 운영되어 왔습니다. 이는 전 세계적으로 그 사례를 찾을 수 없는 비영리 정부출연 연구기관과 수익사업기관의 기형적 통합 구조를 의미합니다.  그 결과 파생되는 문제점은 실로 심각합니다. 가장 대표적인 것은 의학원이 법률이 명시한 정부출연연구소임에도 불구하고 병원 위주로 운영되어 수익사업기관화 되어왔다는 것입니다. 이는 병원과 같은 수익기관이 과학기술부의 지원대상이 아니라는 명분과 상식에 대치된다고 판단되며, 무엇보다도 정부출연 연구비가 수익사업 재원과 혼용되어 관리된 탓에 그 관리의 투명성을 상실해 왔습니다. 이러한 사실과 그 외 제반 문제점들은 최근 언론의 지적(국민일보, 국민논단, 2006년 12월 18일)과 지난 가을 국정감사의 질타도 받아왔으나 아직까지 시정의 기미는 없습니다. 이에 의학원 연구원들은 의학원 본연의 임무인 연구기능의 경쟁력 상실을 심각히 우려하면서 그 최선의 해법으로 방사선의학연구센터와 원자력병원의 재정적, 행정적 분리를 제시해 왔고, 지난 가을 국정감사에서 변재일 의원도 제안한 바 있습니다.  의학원이 원자력연구소로부터 독립되어 재탄생되는 작금의 시기는 그간의 많은 폐습들이 제도적으로 정리되고 정부출연연구소로서의 본연의 모습을 갖출 수 있는 소중한 기회라고 생각됩니다. 그럼에도 불구하고 2007년 1월 18일에 개최된 의학원 설립위원회의 제 1 차 설립회의에서는 원자력병원의 적자를 우려하여 방사선의학연구센터와 통합회계를 계속 유지하고 더욱이 독립된 의학원 원장의 자격 요건에 의사자격증을 명시하자는 발언과 합의가 있었다는 결과를 접하고 엄청난 실망감에 대통령님께 하소연을 드리게 되었습니다.   1. 의학원 본연의 임무수행을 위하여 정부출연연구비로 운영되는 연구기관과 수익사업을 하는 병원의 회계와 행정은 반드시 분리되어져야 합니다.  2. 설립위원들은 의학원장을 “ 반드시 의사면허 소지자여야 한다”고 특정신분으로 자격을 제한하고 있습니다. 이는 의학원을 아직도 정부출연연구소가 아닌 병원으로 인식하고 있는 폐습에 젖은 구태의연한 결정이라 생각됩니다. 의료 행위와 연구행위는 전혀 다른 전문성을 요구합니다. 병원이 아닌 정부출연연구소로서 의학원 설립취지와 목적을 정확히 인식하고 연구소 경영을 위한 역량과 지도력을 갖춘 분을 초대원장으로 모시기를 간절히 희망하고 있습니다.  3. 기타 의학원 운영에 있어서 그간의 문제점에 대한 자료와 저희들의 견해를 첨부하니 검토하여 주시기 바랍니다.  2007년. 1월. 22 일  한국원자력의학원 연구원협의회 일동  ** 첨부 1. 원자력의학원 연구원 연대서명 ** 첨부 2. 회계행정 분리 검토안 ** 첨부 3. 원자력의학원 연구원들의 견해",,,"
1-연구원연대서명.hwp
2-회계행정분리 검토안.hwp
3-연구원들의 견해.hwp","ㅇ 한국원자력의학원 설립위원회에서 병원과 R&D 부문간 회계분리 방안 검토('07.1~3)  ㅇ 제2차 한국원자력의학원 이사회에서 원자력병원과 방사선의학연구소, 국가방사선비상진료센터 간 회계분리 내용으르 반영한 회계규정 심의.의결('077.4.24)","제2차 한국원자력의학원 이사회에서 원자력병원과 방사선의학연구소, 국가방사선비상진료센터 간 회계분리 내용을 반영한 회계규정 심의.의결",,과학기술정보통신부,2007-11-16
